{
  "version": 1,
  "name": "出行乘车词表",
  "license": "CC-BY-SA-4.0",
  "entries": [
    {
      "word": "站牌",
      "definition": "路边写着几路车、到哪儿的那块牌。",
      "example": "看看站牌上有没有这路车。",
      "source": "auto-transit-2026-11"
    },
    {
      "word": "站点",
      "definition": "车停下来让人上下的地方。",
      "example": "这个站点能坐三路公交车。",
      "source": "auto-transit-2026-11"
    },
    {
      "word": "换乘",
      "definition": "在这里下车，再上另一路车。",
      "example": "去火车站中间要换乘一次。",
      "source": "auto-transit-2026-11"
    },
    {
      "word": "方向",
      "definition": "车往哪一边开，坐反了就白跑。",
      "example": "上车以前先看清车往哪边开。",
      "source": "auto-transit-2026-11"
    },
    {
      "word": "终点",
      "definition": "这路车最后停的那个地方。",
      "example": "坐到最后一站就是终点。",
      "source": "auto-transit-2026-11"
    },
    {
      "word": "起点",
      "definition": "这路车头一个开出去的地方。",
      "example": "从起点站上车，才有座位。",
      "source": "auto-transit-2026-11"
    },
    {
      "word": "到站",
      "definition": "车开到站，停下来让人下。",
      "example": "车到站了，该准备下车了。",
      "source": "auto-transit-2026-11"
    },
    {
      "word": "报站",
      "definition": "车上广播说下一站是哪儿。",
      "example": "坐车时听着报站，别坐过站。",
      "source": "auto-transit-2026-11"
    },
    {
      "word": "首班",
      "definition": "每天早上开出的第一班车。",
      "example": "首班车早上六点就开了。",
      "source": "auto-transit-2026-11"
    },
    {
      "word": "末班",
      "definition": "每天晚上开出的最后一班车。",
      "example": "太晚了就赶不上末班车。",
      "source": "auto-transit-2026-11"
    },
    {
      "word": "班次",
      "definition": "车一天开几回，等多长时间。",
      "example": "这条线班次多，不用等太久。",
      "source": "auto-transit-2026-11"
    },
    {
      "word": "车厢",
      "definition": "车里面坐人、站着的那一块。",
      "example": "上车以后往车厢里面走。",
      "source": "auto-transit-2026-11"
    },
    {
      "word": "车门",
      "definition": "上车下车都要经过的那道门。",
      "example": "车门快要关了，不要再上。",
      "source": "auto-transit-2026-11"
    },
    {
      "word": "扶梯",
      "definition": "商场、车站里能站着的电梯。",
      "example": "上二楼可以坐扶梯上去。",
      "source": "auto-transit-2026-11"
    },
    {
      "word": "通道",
      "definition": "车站里让人走过去的那条路。",
      "example": "从通道走到对面的站台。",
      "source": "auto-transit-2026-11"
    },
    {
      "word": "出口",
      "definition": "让人从这里出去的那个口。",
      "example": "从二号出口出去就是大路。",
      "source": "auto-transit-2026-11"
    },
    {
      "word": "入口",
      "definition": "让人从这里进去的那个口。",
      "example": "入口在另一边，得绕过去。",
      "source": "auto-transit-2026-11"
    },
    {
      "word": "票价",
      "definition": "坐这一路车要花多少钱一张。",
      "example": "票价两块，刷卡会便宜点。",
      "source": "auto-transit-2026-11"
    },
    {
      "word": "车票",
      "definition": "坐火车、坐长途车用的票。",
      "example": "车票收好，出站的时候要用。",
      "source": "auto-transit-2026-11"
    },
    {
      "word": "刷卡",
      "definition": "拿卡在机器上轻轻靠一下。",
      "example": "上车的时候刷卡，下车再刷。",
      "source": "auto-transit-2026-11"
    },
    {
      "word": "交通卡",
      "definition": "坐车、坐地铁用的那张卡。",
      "example": "交通卡没钱了，去充一点。",
      "source": "auto-transit-2026-11"
    },
    {
      "word": "候车",
      "definition": "在站台上等着车开过来的那会儿。",
      "example": "请在候车的地方排队等车。",
      "source": "auto-transit-2026-11"
    },
    {
      "word": "让座",
      "definition": "把座位让给比自己更需要的人。",
      "example": "年轻人主动给老人让个座。",
      "source": "auto-transit-2026-11"
    },
    {
      "word": "人行道",
      "definition": "马路边上给人走的那条道。",
      "example": "走路要走人行道，别走车道。",
      "source": "auto-transit-2026-11"
    },
    {
      "word": "天桥",
      "definition": "架在马路上方、能走过去的桥。",
      "example": "过马路的时候走天桥更安全。",
      "source": "auto-transit-2026-11"
    },
    {
      "word": "安检",
      "definition": "进站前把包放机器上查一查。",
      "example": "进地铁站以前要先过安检。",
      "source": "auto-transit-2026-11"
    },
    {
      "word": "实名制",
      "definition": "买票坐车要用真名，还要带身份证。",
      "example": "现在坐火车都是实名制，要带身份证。",
      "source": "auto-transit-2026-11"
    },
    {
      "word": "补票",
      "definition": "上车以后补交没买的票钱。",
      "example": "没买票的要去窗口补票。",
      "source": "auto-transit-2026-11"
    },
    {
      "word": "退票",
      "definition": "不坐了，把票退掉拿回钱。",
      "example": "赶不上这趟车，就只能退票。",
      "source": "auto-transit-2026-11"
    },
    {
      "word": "改签",
      "definition": "把票换成别的时间或车次。",
      "example": "临时有事去不了，改签明天。",
      "source": "auto-transit-2026-11"
    },
    {
      "word": "导航",
      "definition": "手机里给你指路，告诉你往哪边走。",
      "example": "不认得路，打开导航听着走。",
      "source": "auto-transit-2026-11"
    },
    {
      "word": "目的地",
      "definition": "坐车、走路要去的那一个地方。",
      "example": "上车前把目的地告诉司机。",
      "source": "auto-transit-2026-11"
    },
    {
      "word": "时刻表",
      "definition": "写着车几点来、几点走的一张表。",
      "example": "进站先看时刻表，别白等。",
      "source": "auto-transit-2026-11"
    },
    {
      "word": "检票",
      "definition": "上车以前，让人看一眼你的票。",
      "example": "到了检票口，把票拿在手上。",
      "source": "auto-transit-2026-11"
    },
    {
      "word": "过站",
      "definition": "要下的那一站没下去，车往前开走了。",
      "example": "坐过站了别急，下一站下车再回来。",
      "source": "auto-transit-2026-11"
    }
  ]
}
