{
  "version": 1,
  "name": "医院办事词表",
  "license": "CC-BY-SA-4.0",
  "entries": [
    {
      "word": "候诊",
      "definition": "挂完号，坐着等医生叫你。",
      "example": "请在候诊区坐着等叫号。",
      "source": "auto-hospital-2026-11"
    },
    {
      "word": "报告单",
      "definition": "检查结果写在上面的那张纸。",
      "example": "报告单在自助机上打印。",
      "source": "auto-hospital-2026-11"
    },
    {
      "word": "取药",
      "definition": "拿着单子去药房把药拿回来。",
      "example": "交完钱，去一楼药房取药。",
      "source": "auto-hospital-2026-11"
    },
    {
      "word": "复诊",
      "definition": "看完病以后，再回来给医生看。",
      "example": "医生让我下周回来复诊。",
      "source": "auto-hospital-2026-11"
    },
    {
      "word": "门诊",
      "definition": "看病不用住在医院，看完就回家。",
      "example": "这个病看门诊就行，不用住院。",
      "source": "auto-hospital-2026-11"
    },
    {
      "word": "住院",
      "definition": "病比较重，要住在医院里。",
      "example": "医生说他要住院住几天。",
      "source": "auto-hospital-2026-11"
    },
    {
      "word": "出院",
      "definition": "病好得差不多了，从医院回家。",
      "example": "办完出院手续就能回家。",
      "source": "auto-hospital-2026-11"
    },
    {
      "word": "病房",
      "definition": "住院时住的房间，里面有床。",
      "example": "护士带他去了三号病房。",
      "source": "auto-hospital-2026-11"
    },
    {
      "word": "查房",
      "definition": "医生每天早上到病房看病人。",
      "example": "医生查房时会问你哪里不舒服。",
      "source": "auto-hospital-2026-11"
    },
    {
      "word": "陪护",
      "definition": "家里人在医院陪着、照顾病人。",
      "example": "晚上由女儿留下来陪护。",
      "source": "auto-hospital-2026-11"
    },
    {
      "word": "病历",
      "definition": "记着你得过什么病的那本子。",
      "example": "看病的时候把病历本带上。",
      "source": "auto-hospital-2026-11"
    },
    {
      "word": "处方",
      "definition": "医生写下来、告诉你去拿什么药。",
      "example": "拿着医生开的处方去取药。",
      "source": "auto-hospital-2026-11"
    },
    {
      "word": "输液",
      "definition": "把药水从手上慢慢送进身体。",
      "example": "他今天要在医院里输液。",
      "source": "auto-hospital-2026-11"
    },
    {
      "word": "打针",
      "definition": "用针把药水打进身体里面。",
      "example": "护士推着小车来给他打针。",
      "source": "auto-hospital-2026-11"
    },
    {
      "word": "抽血",
      "definition": "用针从手上取一点血去查。",
      "example": "明天早上空着肚子去抽血。",
      "source": "auto-hospital-2026-11"
    },
    {
      "word": "化验",
      "definition": "把血、尿送去检查是什么毛病。",
      "example": "化验结果要等下午才出来。",
      "source": "auto-hospital-2026-11"
    },
    {
      "word": "检查单",
      "definition": "写着要做什么检查的那张单子。",
      "example": "先拿检查单去二楼拍片。",
      "source": "auto-hospital-2026-11"
    },
    {
      "word": "收费处",
      "definition": "医院里排队交钱的那个地方。",
      "example": "先到一楼收费处去交钱。",
      "source": "auto-hospital-2026-11"
    },
    {
      "word": "住院部",
      "definition": "医院里病人住的那一片楼。",
      "example": "住院部在后面的那栋楼。",
      "source": "auto-hospital-2026-11"
    },
    {
      "word": "护士站",
      "definition": "病房外面护士值班的地方。",
      "example": "有事先去护士站问一下。",
      "source": "auto-hospital-2026-11"
    },
    {
      "word": "导诊",
      "definition": "医院门口告诉你去哪个科的人。",
      "example": "不知道去哪科，先问导诊。",
      "source": "auto-hospital-2026-11"
    },
    {
      "word": "医保卡",
      "definition": "看病买药能少花钱的那张卡。",
      "example": "挂号时把医保卡给窗口。",
      "source": "auto-hospital-2026-11"
    },
    {
      "word": "报销",
      "definition": "先自己付钱，以后再退回来一部分。",
      "example": "这笔钱可以拿单子去报销。",
      "source": "auto-hospital-2026-11"
    },
    {
      "word": "自费",
      "definition": "这笔钱医保不管，要自己出。",
      "example": "这个药是自费的，要另外交钱。",
      "source": "auto-hospital-2026-11"
    },
    {
      "word": "押金",
      "definition": "住院前先交的一笔钱，最后再算。",
      "example": "办住院手续要先交一笔押金。",
      "source": "auto-hospital-2026-11"
    },
    {
      "word": "床位",
      "definition": "医院里给病人准备的一张床。",
      "example": "今天没有床位，要等一等。",
      "source": "auto-hospital-2026-11"
    },
    {
      "word": "手术",
      "definition": "医生在病人身上开刀治病。",
      "example": "医生说明天上午做手术。",
      "source": "auto-hospital-2026-11"
    },
    {
      "word": "换药",
      "definition": "把旧的包布拿掉，再上药。",
      "example": "伤口每天都要去医院换药。",
      "source": "auto-hospital-2026-11"
    },
    {
      "word": "转诊",
      "definition": "这个医院看不了，转到别的医院。",
      "example": "医生说这里看不了，要转诊。",
      "source": "auto-hospital-2026-11"
    },
    {
      "word": "抢救",
      "definition": "人很危险的时候，医生马上救人。",
      "example": "半夜里他被送进了抢救室。",
      "source": "auto-hospital-2026-11"
    },
    {
      "word": "监护",
      "definition": "用机器一直看着病人的情况。",
      "example": "他在监护室里住了一晚。",
      "source": "auto-hospital-2026-11"
    },
    {
      "word": "吸氧",
      "definition": "戴上面罩，把氧气吸进去。",
      "example": "老人喘不上气，得赶紧吸氧。",
      "source": "auto-hospital-2026-11"
    },
    {
      "word": "问诊",
      "definition": "医生问你哪里不舒服、多久了。",
      "example": "看病先问诊，然后开单子。",
      "source": "auto-hospital-2026-11"
    },
    {
      "word": "症状",
      "definition": "身上不舒服的样子，比如发烧。",
      "example": "你有哪些症状，跟医生说清楚。",
      "source": "auto-hospital-2026-11"
    },
    {
      "word": "用药",
      "definition": "吃药的方法，还有一次吃多少。",
      "example": "用药一定要按医生说的来。",
      "source": "auto-hospital-2026-11"
    },
    {
      "word": "停药",
      "definition": "医生说停，才不再吃这个药。",
      "example": "这个药不能自己随便停。",
      "source": "auto-hospital-2026-11"
    },
    {
      "word": "空腹",
      "definition": "早上起来还没吃东西的时候。",
      "example": "抽血要空腹，早上先别吃饭。",
      "source": "auto-hospital-2026-11"
    },
    {
      "word": "忌口",
      "definition": "生病的时候，有些东西暂时不能吃。",
      "example": "医生说要忌口，别吃辣的。",
      "source": "auto-hospital-2026-11"
    },
    {
      "word": "加号",
      "definition": "号挂满了，医生再给一个号。",
      "example": "没挂上号，问问能不能加号。",
      "source": "auto-hospital-2026-11"
    },
    {
      "word": "叫号",
      "definition": "广播里念号码，轮到你了。",
      "example": "听到叫号再进诊室看病。",
      "source": "auto-hospital-2026-11"
    },
    {
      "word": "过号",
      "definition": "叫到你的号了，你人没在。",
      "example": "过号了，要去重新签一下。",
      "source": "auto-hospital-2026-11"
    },
    {
      "word": "陪诊",
      "definition": "花钱请人陪着去医院看病。",
      "example": "儿女没空，可以找人陪诊。",
      "source": "auto-hospital-2026-11"
    },
    {
      "word": "就诊",
      "definition": "去医院找大夫看病，从进门到看完。",
      "example": "单子上写着就诊时间，去的时候先看看。",
      "source": "auto-hospital-2026-11"
    },
    {
      "word": "体检",
      "definition": "把身体从头到脚查一遍，看有没有毛病。",
      "example": "体检那天早上要空着肚子，我记在纸上了。",
      "source": "auto-hospital-2026-11"
    },
    {
      "word": "拍片",
      "definition": "用机器照一下身子里面，看骨头和肺。",
      "example": "医生让我去拍片，说照完再回来看。",
      "source": "auto-hospital-2026-11"
    },
    {
      "word": "心电图",
      "definition": "在胸口贴几个片，记下心跳的样子。",
      "example": "做心电图不疼，躺一会儿就好了。",
      "source": "auto-hospital-2026-11"
    },
    {
      "word": "彩超",
      "definition": "用机器在身上照，能看到里面的样子。",
      "example": "做彩超要先空着肚子，护士会告诉你。",
      "source": "auto-hospital-2026-11"
    },
    {
      "word": "探视",
      "definition": "去医院看望住院的家里人，说说话。",
      "example": "医院探视有时间，去的时候先打个电话问问。",
      "source": "auto-hospital-2026-11"
    },
    {
      "word": "疫苗",
      "definition": "打一针，让身体提前不怕某种病。",
      "example": "社区通知老人去打疫苗，带上本子。",
      "source": "auto-hospital-2026-11"
    },
    {
      "word": "康复",
      "definition": "病好以后，慢慢把身体练回来，恢复力气。",
      "example": "出院后他去康复科练走路，一天比一天稳。",
      "source": "auto-hospital-2026-11"
    },
    {
      "word": "内科",
      "definition": "医院里专门看心、肺、胃这些毛病的科。",
      "example": "挂号时窗口问我看哪科，我说看内科。",
      "source": "auto-hospital-2026-11"
    }
  ]
}
