{
  "version": 1,
  "name": "买东西词表",
  "license": "CC-BY-SA-4.0",
  "entries": [
    {
      "word": "商品",
      "definition": "商店或者网上卖的那些东西。",
      "example": "点开商品看看要多少钱。",
      "source": "auto-shopping-2026-11"
    },
    {
      "word": "详情",
      "definition": "这个东西的大小、样子这些说明。",
      "example": "先看看详情再决定买不买。",
      "source": "auto-shopping-2026-11"
    },
    {
      "word": "降价",
      "definition": "东西的价钱比原来便宜了。",
      "example": "这个锅降价了，便宜二十。",
      "source": "auto-shopping-2026-11"
    },
    {
      "word": "优惠",
      "definition": "算钱的时候少收你一点钱。",
      "example": "今天有优惠，能少花一点。",
      "source": "auto-shopping-2026-11"
    },
    {
      "word": "优惠券",
      "definition": "能少花一点钱的那张小券。",
      "example": "结账前先看看有没有优惠券。",
      "source": "auto-shopping-2026-11"
    },
    {
      "word": "包邮",
      "definition": "东西的价钱里已经带了运费。",
      "example": "这家店满三十就给包邮。",
      "source": "auto-shopping-2026-11"
    },
    {
      "word": "运费",
      "definition": "把东西送过来要花的那点钱。",
      "example": "东西的运费要另外算钱。",
      "source": "auto-shopping-2026-11"
    },
    {
      "word": "发货",
      "definition": "商家把东西交给送快递的人。",
      "example": "今天下单，明天就能发货。",
      "source": "auto-shopping-2026-11"
    },
    {
      "word": "快递",
      "definition": "专门送东西的人和他们送的东西。",
      "example": "快递送到门口的小柜子里。",
      "source": "auto-shopping-2026-11"
    },
    {
      "word": "收货",
      "definition": "快递送来了，把东西收下。",
      "example": "收货时先看看包有没有破。",
      "source": "auto-shopping-2026-11"
    },
    {
      "word": "退货",
      "definition": "东西不要了，退还给商家。",
      "example": "大小不合适就可以退货。",
      "source": "auto-shopping-2026-11"
    },
    {
      "word": "换货",
      "definition": "把这个退回去，换一个新的。",
      "example": "东西坏了可以拿去换货。",
      "source": "auto-shopping-2026-11"
    },
    {
      "word": "评价",
      "definition": "买完以后说说东西好不好。",
      "example": "收到货以后可以给个评价。",
      "source": "auto-shopping-2026-11"
    },
    {
      "word": "店铺",
      "definition": "网上卖东西的那一家小店。",
      "example": "这家店铺卖的东西不贵。",
      "source": "auto-shopping-2026-11"
    },
    {
      "word": "购物车",
      "definition": "先放进去、最后一起付的地方。",
      "example": "选好了先放进购物车里。",
      "source": "auto-shopping-2026-11"
    },
    {
      "word": "下单",
      "definition": "决定买了，把单子交上去。",
      "example": "先看清楚价钱，然后再下单。",
      "source": "auto-shopping-2026-11"
    },
    {
      "word": "原价",
      "definition": "还没打折以前的那个价钱。",
      "example": "这个锅原价五十，现在三十。",
      "source": "auto-shopping-2026-11"
    },
    {
      "word": "库存",
      "definition": "店里还剩多少件可以卖出去。",
      "example": "这个颜色库存只剩两件。",
      "source": "auto-shopping-2026-11"
    },
    {
      "word": "缺货",
      "definition": "想买的东西暂时没有货了。",
      "example": "这个尺码缺货，得等一等。",
      "source": "auto-shopping-2026-11"
    },
    {
      "word": "签收",
      "definition": "在单子上写个名，表示收到了。",
      "example": "快递送到了要本人签收。",
      "source": "auto-shopping-2026-11"
    },
    {
      "word": "定金",
      "definition": "先交一点钱，把要买的东西定下来。",
      "example": "交定金前先问清楚，能不能退。",
      "source": "auto-shopping-2026-11"
    },
    {
      "word": "满减",
      "definition": "买够多少钱，就少收你一点钱。",
      "example": "看满减的说明，别为了省钱多买。",
      "source": "auto-shopping-2026-11"
    },
    {
      "word": "售后",
      "definition": "买了东西以后，坏了找他们修或者换。",
      "example": "东西坏了，找售后问问怎么修。",
      "source": "auto-shopping-2026-11"
    },
    {
      "word": "积分",
      "definition": "买得多，店家给的分，能拿去换东西。",
      "example": "积分快到期了，去看看能换点什么。",
      "source": "auto-shopping-2026-11"
    },
    {
      "word": "正品",
      "definition": "真东西，不是别人仿着做的假货。",
      "example": "买以前先看清是不是正品，别急着买。",
      "source": "auto-shopping-2026-11"
    }
  ]
}
