{
  "version": 1,
  "name": "手机屏幕词表",
  "license": "CC-BY-SA-4.0",
  "entries": [
    {
      "word": "蓝牙",
      "definition": "手机和别的设备不用线就能连。",
      "example": "耳机开蓝牙就能连手机。",
      "source": "auto-phone-2026-11"
    },
    {
      "word": "流量",
      "definition": "手机上网用的，用完了要另外买。",
      "example": "这个月手机流量用完了。",
      "source": "auto-phone-2026-11"
    },
    {
      "word": "套餐",
      "definition": "每月固定交多少钱、能用多少。",
      "example": "去营业厅改个便宜点的套餐。",
      "source": "auto-phone-2026-11"
    },
    {
      "word": "话费",
      "definition": "打电话、上网都要交的钱。",
      "example": "这个月话费不多了，记得充。",
      "source": "auto-phone-2026-11"
    },
    {
      "word": "充值",
      "definition": "先交钱，让手机里有钱用。",
      "example": "手机停了，要赶紧去充值。",
      "source": "auto-phone-2026-11"
    },
    {
      "word": "欠费",
      "definition": "该交的钱到日子了还没交。",
      "example": "欠费了会打不出去电话。",
      "source": "auto-phone-2026-11"
    },
    {
      "word": "停机",
      "definition": "手机不能打电话、上网了。",
      "example": "手机停机了，得先去交钱。",
      "source": "auto-phone-2026-11"
    },
    {
      "word": "来电",
      "definition": "别人打电话打到你手机上。",
      "example": "来电显示是一个陌生号码。",
      "source": "auto-phone-2026-11"
    },
    {
      "word": "通话",
      "definition": "两个人在电话里说了一会儿话。",
      "example": "通话记录里能看见谁打来的。",
      "source": "auto-phone-2026-11"
    },
    {
      "word": "通讯录",
      "definition": "手机里存人名和号码的地方。",
      "example": "号码都存在手机的通讯录里。",
      "source": "auto-phone-2026-11"
    },
    {
      "word": "联系人",
      "definition": "存了名字和电话的那个人。",
      "example": "先加个联系人，再打电话。",
      "source": "auto-phone-2026-11"
    },
    {
      "word": "铃声",
      "definition": "有人打电话来，手机响的声音。",
      "example": "把手机的铃声调大一点。",
      "source": "auto-phone-2026-11"
    },
    {
      "word": "震动",
      "definition": "手机不响，只轻轻抖一下。",
      "example": "开会时把手机调成震动。",
      "source": "auto-phone-2026-11"
    },
    {
      "word": "免提",
      "definition": "不用拿起来，声音放出来大家听。",
      "example": "按免提，屋里人都能听见。",
      "source": "auto-phone-2026-11"
    },
    {
      "word": "扬声器",
      "definition": "手机放声音出来的那个小口。",
      "example": "声音是从扬声器里出来的。",
      "source": "auto-phone-2026-11"
    },
    {
      "word": "麦克风",
      "definition": "手机里收你说话声音的那个小口。",
      "example": "麦克风被挡住，对方听不见。",
      "source": "auto-phone-2026-11"
    },
    {
      "word": "摄像头",
      "definition": "手机上拍照、能看见人的那个小孔。",
      "example": "视频时把摄像头对着脸。",
      "source": "auto-phone-2026-11"
    },
    {
      "word": "定位",
      "definition": "手机知道你现在在什么地方。",
      "example": "手机导航要用定位才准。",
      "source": "auto-phone-2026-11"
    },
    {
      "word": "备份",
      "definition": "把手机里的东西另外存一份。",
      "example": "换新手机前先把东西备份。",
      "source": "auto-phone-2026-11"
    },
    {
      "word": "同步",
      "definition": "两边的东西自动变成一样。",
      "example": "照片同步到网上就不怕丢。",
      "source": "auto-phone-2026-11"
    },
    {
      "word": "云端",
      "definition": "存在网上的地方，不占手机。",
      "example": "照片存在云端，换手机还在。",
      "source": "auto-phone-2026-11"
    },
    {
      "word": "小程序",
      "definition": "微信里不用另外装的小软件。",
      "example": "挂号用医院的小程序就行。",
      "source": "auto-phone-2026-11"
    },
    {
      "word": "公众号",
      "definition": "微信里能看文章、能关注的那种号。",
      "example": "关注医院的公众号就能查报告。",
      "source": "auto-phone-2026-11"
    },
    {
      "word": "收藏",
      "definition": "把看到的东西存起来，以后再看。",
      "example": "这篇文章点收藏，回头再看。",
      "source": "auto-phone-2026-11"
    },
    {
      "word": "转发",
      "definition": "把收到的东西再发给别人。",
      "example": "这条消息不要随便转发。",
      "source": "auto-phone-2026-11"
    },
    {
      "word": "分享",
      "definition": "把好东西发给朋友一起看。",
      "example": "把孙子的照片分享给女儿。",
      "source": "auto-phone-2026-11"
    },
    {
      "word": "群聊",
      "definition": "好几个人在一个群里说话。",
      "example": "晚上一家人在群聊里说话。",
      "source": "auto-phone-2026-11"
    },
    {
      "word": "群主",
      "definition": "建这个群、管这个群的人。",
      "example": "群主把新来的人拉进来。",
      "source": "auto-phone-2026-11"
    },
    {
      "word": "头像",
      "definition": "网上代表你本人的那张小图。",
      "example": "头像换了，我一眼认不出。",
      "source": "auto-phone-2026-11"
    },
    {
      "word": "备注",
      "definition": "自己给联系人另起的名字。",
      "example": "给他加个备注，好认一些。",
      "source": "auto-phone-2026-11"
    },
    {
      "word": "免打扰",
      "definition": "群里消息来了，手机不响。",
      "example": "晚上把群设置成免打扰。",
      "source": "auto-phone-2026-11"
    },
    {
      "word": "聊天",
      "definition": "在手机上你一句我一句说话。",
      "example": "晚上跟孙子聊了一会儿天。",
      "source": "auto-phone-2026-11"
    },
    {
      "word": "相册",
      "definition": "手机里存照片的那个地方。",
      "example": "孙子的照片都在相册里。",
      "source": "auto-phone-2026-11"
    },
    {
      "word": "拍摄",
      "definition": "用手机把眼前的东西照下来。",
      "example": "这里光线暗，拍摄不清楚。",
      "source": "auto-phone-2026-11"
    },
    {
      "word": "输入法",
      "definition": "在手机上打字用的那个东西。",
      "example": "输入法可以换成手写输入。",
      "source": "auto-phone-2026-11"
    },
    {
      "word": "电池",
      "definition": "手机里面存电的那个东西。",
      "example": "电池不耐用了，一天要充两回。",
      "source": "auto-phone-2026-11"
    },
    {
      "word": "信号",
      "definition": "手机连得上网的力气大不大。",
      "example": "山里信号不好，电话打不通。",
      "source": "auto-phone-2026-11"
    },
    {
      "word": "省电",
      "definition": "想办法让手机的电用得慢一些。",
      "example": "打开省电模式，能用久点。",
      "source": "auto-phone-2026-11"
    },
    {
      "word": "广告",
      "definition": "手机上突然冒出来，叫你买东西的字和画。",
      "example": "这些广告一点就跳走，别乱按。",
      "source": "auto-phone-2026-11"
    },
    {
      "word": "版本",
      "definition": "软件改过以后，新出来的那一份。",
      "example": "手机上说要换新版本，先问家里人。",
      "source": "auto-phone-2026-11"
    },
    {
      "word": "提示",
      "definition": "手机上面跳出来的一句话，告诉你出了什么事。",
      "example": "看到提示，先看清楚上面写的字，再按。",
      "source": "auto-phone-2026-11"
    },
    {
      "word": "字体",
      "definition": "手机上字的样子，能调大，也能调小。",
      "example": "字太小看不清，把字体调大一点。",
      "source": "auto-phone-2026-11"
    },
    {
      "word": "存储",
      "definition": "手机里存照片、存消息的地方，满了就装不下。",
      "example": "手机说存储不够，先清掉不用的照片。",
      "source": "auto-phone-2026-11"
    }
  ]
}
