{
  "version": 1,
  "name": "防骗安全词表",
  "license": "CC-BY-SA-4.0",
  "entries": [
    {
      "word": "客服",
      "definition": "接电话、帮你处理问题的人。",
      "example": "有事先打官方客服电话。",
      "source": "auto-fraud-2026-11"
    },
    {
      "word": "诈骗",
      "definition": "用假话把别人的钱骗到手。",
      "example": "这种电话就是诈骗，别信。",
      "source": "auto-fraud-2026-11"
    },
    {
      "word": "骗子",
      "definition": "专门说假话、骗人钱财的人。",
      "example": "打电话的是骗子，快挂断。",
      "source": "auto-fraud-2026-11"
    },
    {
      "word": "冒充",
      "definition": "装成别人的样子，让人相信。",
      "example": "有人冒充医生打电话来。",
      "source": "auto-fraud-2026-11"
    },
    {
      "word": "假冒",
      "definition": "拿假东西装成真的卖给老人。",
      "example": "假冒的保健品千万别买。",
      "source": "auto-fraud-2026-11"
    },
    {
      "word": "安全账户",
      "definition": "骗子编出来的说法，说钱放进去才安全。",
      "example": "没有安全账户，别信这句话。",
      "source": "auto-fraud-2026-11"
    },
    {
      "word": "刷单",
      "definition": "假买东西、帮店家把销量做上去。",
      "example": "网上说刷单能挣钱的，别信。",
      "source": "auto-fraud-2026-11"
    },
    {
      "word": "返利",
      "definition": "买东西或交钱以后，再退一点给你。",
      "example": "说返利先交钱的，要小心。",
      "source": "auto-fraud-2026-11"
    },
    {
      "word": "陌生来电",
      "definition": "不认识的号码突然打进来。",
      "example": "陌生来电说你中奖了，别信。",
      "source": "auto-fraud-2026-11"
    },
    {
      "word": "骚扰",
      "definition": "没完没了地打电话、发消息。",
      "example": "总打来的骚扰电话可以拦。",
      "source": "auto-fraud-2026-11"
    },
    {
      "word": "拦截",
      "definition": "把不想接的电话挡在外面。",
      "example": "把陌生号码设置成拦截。",
      "source": "auto-fraud-2026-11"
    },
    {
      "word": "黑名单",
      "definition": "你不想再接的那些电话号码。",
      "example": "把骗子的号码拉进黑名单。",
      "source": "auto-fraud-2026-11"
    },
    {
      "word": "举报",
      "definition": "把骗人的事告诉管事的人。",
      "example": "遇到骗子可以打电话举报。",
      "source": "auto-fraud-2026-11"
    },
    {
      "word": "报警",
      "definition": "打电话给警察，让警察来管。",
      "example": "钱被骗了，要马上打电话报警。",
      "source": "auto-fraud-2026-11"
    },
    {
      "word": "报案",
      "definition": "到派出所把被骗的事说清楚。",
      "example": "第二天一早去派出所报案。",
      "source": "auto-fraud-2026-11"
    },
    {
      "word": "录音",
      "definition": "把电话里说的话录下来存着。",
      "example": "接陌生电话的时候录个音。",
      "source": "auto-fraud-2026-11"
    },
    {
      "word": "屏幕共享",
      "definition": "让对方看见你的手机屏幕。",
      "example": "让你开屏幕共享的，要当心。",
      "source": "auto-fraud-2026-11"
    },
    {
      "word": "远程控制",
      "definition": "别人不在这儿，也能动你的手机。",
      "example": "让陌生人远程控制手机很危险。",
      "source": "auto-fraud-2026-11"
    },
    {
      "word": "木马",
      "definition": "藏在软件里、会偷东西的坏程序。",
      "example": "乱装软件容易带进木马。",
      "source": "auto-fraud-2026-11"
    },
    {
      "word": "虚假",
      "definition": "看着像真的，但并不是真的。",
      "example": "虚假广告往往说得特别好。",
      "source": "auto-fraud-2026-11"
    },
    {
      "word": "诱导",
      "definition": "用好听的话引着你一步步去做。",
      "example": "别被电话里几句好话诱导。",
      "source": "auto-fraud-2026-11"
    },
    {
      "word": "威胁",
      "definition": "说要让你吃苦头，逼你听话。",
      "example": "对方威胁你，更要挂电话。",
      "source": "auto-fraud-2026-11"
    },
    {
      "word": "泄露",
      "definition": "不该让别人知道的，说出去了。",
      "example": "卡号密码不要泄露给别人。",
      "source": "auto-fraud-2026-11"
    },
    {
      "word": "个人信息",
      "definition": "名字、电话、住址这些私人的事。",
      "example": "别人的个人信息不能乱给。",
      "source": "auto-fraud-2026-11"
    },
    {
      "word": "点开",
      "definition": "用手指按一下，把它打开。",
      "example": "不认识的链接千万别点开。",
      "source": "auto-fraud-2026-11"
    },
    {
      "word": "领奖",
      "definition": "拿着单子去把奖拿回来。",
      "example": "先交钱才能领奖，是骗人的。",
      "source": "auto-fraud-2026-11"
    },
    {
      "word": "退税",
      "definition": "把多交的税钱退回到卡里。",
      "example": "说帮你退税的，先打官方电话问。",
      "source": "auto-fraud-2026-11"
    },
    {
      "word": "保健品",
      "definition": "说能补身体、养生的那些东西。",
      "example": "保健品不能当成药来吃。",
      "source": "auto-fraud-2026-11"
    },
    {
      "word": "投资",
      "definition": "把钱放进去，想多拿回来。",
      "example": "说保本高息的投资，别信。",
      "source": "auto-fraud-2026-11"
    },
    {
      "word": "高息",
      "definition": "说给的利息比银行高很多。",
      "example": "高息背后常常藏着一个骗局。",
      "source": "auto-fraud-2026-11"
    },
    {
      "word": "返现",
      "definition": "花完钱以后，再退一点钱给你。",
      "example": "说刷完返现的，多半是骗。",
      "source": "auto-fraud-2026-11"
    },
    {
      "word": "抽奖",
      "definition": "从一堆人里抽几个给东西。",
      "example": "抽奖要先交钱的，千万别去。",
      "source": "auto-fraud-2026-11"
    },
    {
      "word": "保证金",
      "definition": "先交一笔钱做保证，说以后会还。",
      "example": "让交保证金才能领奖，是骗人的。",
      "source": "auto-fraud-2026-11"
    },
    {
      "word": "熟人",
      "definition": "平时认识、打过交道的人。",
      "example": "熟人借钱也要打个电话问。",
      "source": "auto-fraud-2026-11"
    },
    {
      "word": "弹窗",
      "definition": "自己从手机上跳出来的小窗口。",
      "example": "先关掉跳出来的那个弹窗。",
      "source": "auto-fraud-2026-11"
    },
    {
      "word": "骗局",
      "definition": "别人设好、专门骗钱的圈套。",
      "example": "这个骗局已经骗了不少人。",
      "source": "auto-fraud-2026-11"
    },
    {
      "word": "上当",
      "definition": "信了别人的假话，吃了亏。",
      "example": "多问一句，就不容易上当。",
      "source": "auto-fraud-2026-11"
    },
    {
      "word": "反诈",
      "definition": "教人认出骗子，别上当吃亏。",
      "example": "社区常来人讲反诈的事。",
      "source": "auto-fraud-2026-11"
    },
    {
      "word": "洗钱",
      "definition": "坏人把来路不正的钱，装成干净钱。",
      "example": "电话说你洗钱，别信，先问家里人。",
      "source": "auto-fraud-2026-11"
    },
    {
      "word": "征信",
      "definition": "银行记着你借钱有没有按时还的记录。",
      "example": "有人说你征信坏了，当心，先问家里人。",
      "source": "auto-fraud-2026-11"
    },
    {
      "word": "理赔",
      "definition": "东西坏了，保险公司按合同赔钱。",
      "example": "说要给你理赔，当心是骗人的，先问家里人。",
      "source": "auto-fraud-2026-11"
    },
    {
      "word": "兼职",
      "definition": "除了平常的活，另外再找一份活干。",
      "example": "网上说在家兼职能挣钱，别信，先问家里人。",
      "source": "auto-fraud-2026-11"
    },
    {
      "word": "传票",
      "definition": "法院叫你哪天去哪儿的一张纸。",
      "example": "说法院传票要你交钱，别信，先问家里人。",
      "source": "auto-fraud-2026-11"
    }
  ]
}
